<?xml version="1.0" encoding="UTF-8"?>
<!-- edited with XMLSpy v2012 rel. 2 sp1 (http://www.altova.com) by 21 users of IT (Deutsche Bundesbank Frankfurt) -->
<!--Achtung: Beispieldatei, keine Produktivdaten! -->
<!--Beispieldatei SCL-Teilnehmer, Full table -->
<Document xsi:schemaLocation="urn:rocs.001.001.06 Rocs.001.001.06.xsd" xmlns="urn:rocs.001.001.06" xmlns:xsi="http://www.w3.org/2001/XMLSchema-instance">
	<rocs.001.001.06>
		<GrpHdr>
			<MsgId>MARKDEFF201808090001</MsgId>
			<CreDtTm>2018-08-09T00:00:00</CreDtTm>
			<PtyId>
				<BICOrBEI>MARKDEFFXXX</BICOrBEI>
			</PtyId>
			<FullTable>1</FullTable>
			<FileValidityDate>2018-08-13T00:00:00</FileValidityDate>
		</GrpHdr>
		<RchEntry>
			<Status>existing</Status>
			<Validity>
				<FrDtTm>2013-10-07T15:00:00</FrDtTm>
			</Validity>
			<Participant>
				<BIC>AAAADEFF</BIC>
				<NmAndAdr>
					<Nm>A-Bank</Nm>
				</NmAndAdr>
			</Participant>
			<Product>
				<ProductName>SCT</ProductName>
			</Product>
			<CSM>
				<PtyId>
					<BICOrBEI>MARKDEFF</BICOrBEI>
				</PtyId>
				<PreferredIndicator>1</PreferredIndicator>
			</CSM>
			<CutOff>
				<Time>15:00:00</Time>
				<RelDays>0</RelDays>
				<TimeZone>CET</TimeZone>
			</CutOff>
		</RchEntry>
		<RchEntry>
			<Status>existing</Status>
			<Validity>
				<FrDtTm>2013-09-09T15:00:00</FrDtTm>
			</Validity>
			<Participant>
				<BIC>AAAADEFF</BIC>
				<NmAndAdr>
					<Nm>A-Bank</Nm>
				</NmAndAdr>
			</Participant>
			<Product>
				<ProductName>SDD core</ProductName>
			</Product>
			<CSM>
				<PtyId>
					<BICOrBEI>MARKDEFF</BICOrBEI>
				</PtyId>
				<PreferredIndicator>1</PreferredIndicator>
			</CSM>
			<CutOff>
				<Time>15:00:00</Time>
				<RelDays>0</RelDays>
				<TimeZone>CET</TimeZone>
			</CutOff>
		</RchEntry>
		<RchEntry>
			<Status>existing</Status>
			<Validity>
				<FrDtTm>2013-09-09T14:00:00</FrDtTm>
			</Validity>
			<Participant>
				<BIC>AAAADEFF</BIC>
				<NmAndAdr>
					<Nm>A-Bank</Nm>
				</NmAndAdr>
			</Participant>
			<Product>
				<ProductName>SDD b2b</ProductName>
			</Product>
			<CSM>
				<PtyId>
					<BICOrBEI>MARKDEFF</BICOrBEI>
				</PtyId>
				<PreferredIndicator>1</PreferredIndicator>
			</CSM>
			<CutOff>
				<Time>14:00:00</Time>
				<RelDays>0</RelDays>
				<TimeZone>CET</TimeZone>
			</CutOff>
		</RchEntry>
		<RchEntry>
			<Status>existing</Status>
			<Validity>
				<FrDtTm>2013-09-09T15:00:00</FrDtTm>
				<ToDtTm>2018-08-13T15:00:00</ToDtTm>
			</Validity>
			<Participant>
				<BIC>BBBBDEFFXXX</BIC>
				<NmAndAdr>
					<Nm>B-Bank</Nm>
				</NmAndAdr>
			</Participant>
			<Product>
				<ProductName>SDD core</ProductName>
			</Product>
			<CSM>
				<PtyId>
					<PrtryId>
						<Id>Other CSM</Id>
					</PrtryId>
				</PtyId>
				<PreferredIndicator>1</PreferredIndicator>
			</CSM>
			<CutOff>
				<Time>15:00:00</Time>
				<RelDays>0</RelDays>
				<TimeZone>CET</TimeZone>
			</CutOff>
		</RchEntry>
		<RchEntry>
			<Status>existing</Status>
			<Validity>
				<FrDtTm>2018-08-13T15:00:00</FrDtTm>
			</Validity>
			<Participant>
				<BIC>CCCCDEFFXYZ</BIC>
				<NmAndAdr>
					<Nm>XYZ-Bank</Nm>
				</NmAndAdr>
			</Participant>
			<Product>
				<ProductName>SCT</ProductName>
			</Product>
			<CSM>
				<PtyId>
					<PrtryId>
						<Id>Other CSM</Id>
					</PrtryId>
				</PtyId>
				<PreferredIndicator>1</PreferredIndicator>
			</CSM>
			<CutOff>
				<Time>15:00:00</Time>
				<RelDays>0</RelDays>
				<TimeZone>CET</TimeZone>
			</CutOff>
		</RchEntry>
		<RchEntry>
			<Status>existing</Status>
			<Validity>
				<FrDtTm>2013-08-05T15:00:00</FrDtTm>
				<ToDtTm>2018-08-13T15:00:00</ToDtTm>
			</Validity>
			<Participant>
				<BIC>DDDDDEFF</BIC>
				<NmAndAdr>
					<Nm>D-Bank</Nm>
				</NmAndAdr>
			</Participant>
			<Product>
				<ProductName>SDD core</ProductName>
			</Product>
			<CSM>
				<PtyId>
					<BICOrBEI>MARKDEFF</BICOrBEI>
				</PtyId>
				<PreferredIndicator>1</PreferredIndicator>
			</CSM>
			<CutOff>
				<Time>15:00:00</Time>
				<RelDays>0</RelDays>
				<TimeZone>CET</TimeZone>
			</CutOff>
		</RchEntry>
		<RchEntry>
			<Status>existing</Status>
			<Validity>
				<FrDtTm>2018-08-13T15:00:00</FrDtTm>
			</Validity>
			<Participant>
				<BIC>GGGGDEFFXXX</BIC>
				<NmAndAdr>
					<Nm>G-Bank</Nm>
				</NmAndAdr>
			</Participant>
			<Product>
				<ProductName>SDD core</ProductName>
			</Product>
			<CSM>
				<PtyId>
					<BICOrBEI>MARKDEFF</BICOrBEI>
				</PtyId>
				<PreferredIndicator>1</PreferredIndicator>
			</CSM>
			<CutOff>
				<Time>15:00:00</Time>
				<RelDays>0</RelDays>
				<TimeZone>CET</TimeZone>
			</CutOff>
		</RchEntry>
		<RchEntry>
			<Status>existing</Status>
			<Validity>
				<FrDtTm>2018-08-13T15:00:00</FrDtTm>
			</Validity>
			<Participant>
				<BIC>HHHHDEFF</BIC>
				<NmAndAdr>
					<Nm>H-Bank</Nm>
				</NmAndAdr>
			</Participant>
			<Product>
				<ProductName>SCT</ProductName>
			</Product>
			<CSM>
				<PtyId>
					<BICOrBEI>MARKDEFF</BICOrBEI>
				</PtyId>
				<PreferredIndicator>1</PreferredIndicator>
			</CSM>
			<CutOff>
				<Time>15:00:00</Time>
				<RelDays>0</RelDays>
				<TimeZone>CET</TimeZone>
			</CutOff>
		</RchEntry>
		<RchEntry>
			<Status>existing</Status>
			<Validity>
				<FrDtTm>2018-08-13T15:00:00</FrDtTm>
			</Validity>
			<Participant>
				<BIC>JJJJDEFFABC</BIC>
				<NmAndAdr>
					<Nm>J-Bank</Nm>
				</NmAndAdr>
			</Participant>
			<Product>
				<ProductName>SCT</ProductName>
			</Product>
			<CSM>
				<PtyId>
					<BICOrBEI>MARKDEFF</BICOrBEI>
				</PtyId>
				<PreferredIndicator>1</PreferredIndicator>
			</CSM>
			<CutOff>
				<Time>15:00:00</Time>
				<RelDays>0</RelDays>
				<TimeZone>CET</TimeZone>
			</CutOff>
		</RchEntry>
		<RchEntry>
			<Status>existing</Status>
			<Validity>
				<FrDtTm>2018-08-13T15:00:00</FrDtTm>
			</Validity>
			<Participant>
				<BIC>JJJJDEFF</BIC>
				<NmAndAdr>
					<Nm>J-Bank</Nm>
				</NmAndAdr>
			</Participant>
			<Product>
				<ProductName>SCT</ProductName>
			</Product>
			<CSM>
				<PtyId>
					<PrtryId>
						<Id>Other CSM</Id>
					</PrtryId>
				</PtyId>
				<PreferredIndicator>1</PreferredIndicator>
			</CSM>
			<CutOff>
				<Time>15:00:00</Time>
				<RelDays>0</RelDays>
				<TimeZone>CET</TimeZone>
			</CutOff>
		</RchEntry>
		<RchEntry>
			<Status>existing</Status>
			<Validity>
				<FrDtTm>2018-08-13T15:00:00</FrDtTm>
			</Validity>
			<Participant>
				<BIC>KKKKDEFF</BIC>
				<NmAndAdr>
					<Nm>K-Bank</Nm>
				</NmAndAdr>
			</Participant>
			<Product>
				<ProductName>SDD core</ProductName>
			</Product>
			<CSM>
				<PtyId>
					<PrtryId>
						<Id>Other CSM</Id>
					</PrtryId>
				</PtyId>
				<PreferredIndicator>1</PreferredIndicator>
			</CSM>
			<CutOff>
				<Time>15:00:00</Time>
				<RelDays>0</RelDays>
				<TimeZone>CET</TimeZone>
			</CutOff>
		</RchEntry>
	</rocs.001.001.06>
</Document>
