<?xml version="1.0" encoding="UTF-8"?>
<!--Achtung: Beispieldatei, keine Produktivdaten! -->
<!--Beispieldatei SCL-Teilnehmer, Delta table -->
<Document xmlns="urn:rocs.001.001.06" xmlns:xsi="http://www.w3.org/2001/XMLSchema-instance" xsi:schemaLocation="urn:rocs.001.001.06 Rocs.001.001.06.xsd">
  <rocs.001.001.06>
    <GrpHdr>
      <MsgId>MARKDEFF201808090001</MsgId>
      <CreDtTm>2018-08-09T00:00:00</CreDtTm>
      <PtyId>
        <BICOrBEI>MARKDEFFXXX</BICOrBEI>
      </PtyId>
      <FullTable>0</FullTable>
      <FileValidityDate>2018-08-13T00:00:00</FileValidityDate>
    </GrpHdr>
    <RchEntry>
      <Status>new</Status>
      <Validity>
        <FrDtTm>2018-08-13T15:00:00</FrDtTm>
      </Validity>
      <Participant>
        <BIC>AAAADEFF</BIC>
        <NmAndAdr>
          <Nm>A-Bank</Nm>
        </NmAndAdr>
      </Participant>
      <Product>
        <ProductName>SDD core</ProductName>
      </Product>
      <CSM>
        <PtyId>
          <BICOrBEI>MARKDEFF</BICOrBEI>
        </PtyId>
        <PreferredIndicator>1</PreferredIndicator>
      </CSM>
      <CutOff>
        <Time>15:00:00</Time>
        <RelDays>0</RelDays>
        <TimeZone>CET</TimeZone>
      </CutOff>
    </RchEntry>
    <RchEntry>
      <Status>changed</Status>
      <Validity>
        <FrDtTm>2018-08-13T15:00:00</FrDtTm>
      </Validity>
      <Participant>
        <BIC>CCCCDEFFXYZ</BIC>
        <NmAndAdr>
          <Nm>XYZ-Bank</Nm>
        </NmAndAdr>
      </Participant>
      <Product>
        <ProductName>SCT</ProductName>
      </Product>
      <CSM>
        <PtyId>
          <BICOrBEI>MARKDEFF</BICOrBEI>
        </PtyId>
        <PreferredIndicator>1</PreferredIndicator>
      </CSM>
      <CutOff>
        <Time>15:00:00</Time>
        <RelDays>0</RelDays>
        <TimeZone>CET</TimeZone>
      </CutOff>
    </RchEntry>
    <RchEntry>
      <Status>deleted</Status>
      <Validity>
        <FrDtTm>2018-08-13T15:00:00</FrDtTm>
      </Validity>
      <Participant>
        <BIC>DDDDDEFFXXX</BIC>
        <NmAndAdr>
          <Nm>D-Bank</Nm>
        </NmAndAdr>
      </Participant>
      <Product>
        <ProductName>SDD core</ProductName>
      </Product>
      <CSM>
        <PtyId>
          <BICOrBEI>MARKDEFF</BICOrBEI>
        </PtyId>
        <PreferredIndicator>1</PreferredIndicator>
      </CSM>
      <CutOff>
        <Time>15:00:00</Time>
        <RelDays>0</RelDays>
        <TimeZone>CET</TimeZone>
      </CutOff>
    </RchEntry>
    <RchEntry>
      <Status>deleted</Status>
      <Validity>
        <FrDtTm>2018-08-13T14:00:00</FrDtTm>
      </Validity>
      <Participant>
        <BIC>DDDDDEFFXXX</BIC>
        <NmAndAdr>
          <Nm>D-Bank</Nm>
        </NmAndAdr>
      </Participant>
      <Product>
        <ProductName>SDD b2b</ProductName>
      </Product>
      <CSM>
        <PtyId>
          <BICOrBEI>MARKDEFF</BICOrBEI>
        </PtyId>
        <PreferredIndicator>1</PreferredIndicator>
      </CSM>
      <CutOff>
        <Time>14:00:00</Time>
        <RelDays>0</RelDays>
        <TimeZone>CET</TimeZone>
      </CutOff>
    </RchEntry>
    <RchEntry>
      <Status>deleted</Status>
      <Validity>
        <FrDtTm>2018-08-13T15:00:00</FrDtTm>
      </Validity>
      <Participant>
        <BIC>EEEEDEFF</BIC>
        <NmAndAdr>
          <Nm>E-Bank</Nm>
        </NmAndAdr>
      </Participant>
      <Product>
        <ProductName>SCT</ProductName>
      </Product>
      <CSM>
        <PtyId>
          <PrtryId>
            <Id>Other CSM</Id>
          </PrtryId>
        </PtyId>
        <PreferredIndicator>1</PreferredIndicator>
      </CSM>
      <CutOff>
        <Time>15:00:00</Time>
        <RelDays>0</RelDays>
        <TimeZone>CET</TimeZone>
      </CutOff>
    </RchEntry>
  </rocs.001.001.06>
</Document>
